Task Name,Status,Details
Define Return Policy,Complete,"Created clear policy for returns and refunds. Included time limits, acceptable reasons, and required condition."
Set Up Returns Process,In Progress,"Building workflow for handling return requests. Includes RMA numbers and inspection steps."
Train Support Staff,Planned,"Train staff on managing returns and disputes. Provide scripts and FAQ."
Monitor Return Cases,Planned,"Track and analyze reasons for returns. Look for patterns or recurring issues."
Resolve Disputes,Planned,"Establish process for resolving buyer-seller disputes. Use escalation path if needed."
Document Return Outcomes,Planned,"Record outcomes of returns and disputes for future reference."
