Task Name,Status,Details
Design Featured Listing Option,Complete,"Created UI/UX for promoting listings. Included preview and selection during listing creation."
Set Featured Listing Pricing,Complete,"Established pricing for featured placement. Compared with standard listing fees and competitor rates."
Implement Featured Logic,In Progress,"Developing backend and frontend for featured status. Testing display order and highlighting."
Promote Featured Listings,Planned,"Highlight featured listings on homepage and search. Use banners or badges for visibility."
Track Featured Listing Performance,Planned,"Monitor engagement and conversion for featured listings. Share stats with sellers."
Document Featured Policy,Planned,"Write clear rules for featured listing eligibility and duration."
