Task Name,Status,Details
Research Ad Platforms,Complete,"Evaluated third-party and in-house ad solutions. Compared revenue models and ease of integration."
Design Ad Placement,Complete,"Planned ad locations on the platform. Considered user experience and ad visibility."
Integrate Ad System,In Progress,"Building ad management and display features. Testing with demo ads and tracking impressions."
Monitor Ad Performance,Planned,"Track impressions, clicks, and revenue. Use simple analytics dashboard."
Optimize Ad Strategy,Planned,"Adjust ad placements and types for best results. Test different formats and partners."
Document Ad Policy,Planned,"Write guidelines for acceptable ads and reporting abuse."
